{
  "sheetName": "npc",
  "inputPath": "npc.png",
  "outputTileSize": 32,
  "sourceImageSize": { "width": 2048, "height": 2048 },
  "gridLine": {
    "enabled": false
  },
  "mode": "rects",
  "rects": [
    { "name": "npc_00_down_0", "x": 0, "y": 0, "w": 256, "h": 256 },
    { "name": "npc_00_down_1", "x": 256, "y": 0, "w": 256, "h": 256 },
    { "name": "npc_00_left_0", "x": 512, "y": 0, "w": 256, "h": 256 },
    { "name": "npc_00_left_1", "x": 768, "y": 0, "w": 256, "h": 256 },
    { "name": "npc_00_right_0", "x": 1024, "y": 0, "w": 256, "h": 256 },
    { "name": "npc_00_right_1", "x": 1280, "y": 0, "w": 256, "h": 256 },
    { "name": "npc_00_up_0", "x": 1536, "y": 0, "w": 256, "h": 256 },
    { "name": "npc_00_up_1", "x": 1792, "y": 0, "w": 256, "h": 256 },

    { "name": "npc_01_down_0", "x": 0, "y": 256, "w": 256, "h": 256 },
    { "name": "npc_01_down_1", "x": 256, "y": 256, "w": 256, "h": 256 },
    { "name": "npc_01_left_0", "x": 512, "y": 256, "w": 256, "h": 256 },
    { "name": "npc_01_left_1", "x": 768, "y": 256, "w": 256, "h": 256 },
    { "name": "npc_01_right_0", "x": 1024, "y": 256, "w": 256, "h": 256 },
    { "name": "npc_01_right_1", "x": 1280, "y": 256, "w": 256, "h": 256 },
    { "name": "npc_01_up_0", "x": 1536, "y": 256, "w": 256, "h": 256 },
    { "name": "npc_01_up_1", "x": 1792, "y": 256, "w": 256, "h": 256 },

    { "name": "npc_02_down_0", "x": 0, "y": 512, "w": 256, "h": 256 },
    { "name": "npc_02_down_1", "x": 256, "y": 512, "w": 256, "h": 256 },
    { "name": "npc_02_left_0", "x": 512, "y": 512, "w": 256, "h": 256 },
    { "name": "npc_02_left_1", "x": 768, "y": 512, "w": 256, "h": 256 },
    { "name": "npc_02_right_0", "x": 1024, "y": 512, "w": 256, "h": 256 },
    { "name": "npc_02_right_1", "x": 1280, "y": 512, "w": 256, "h": 256 },
    { "name": "npc_02_up_0", "x": 1536, "y": 512, "w": 256, "h": 256 },
    { "name": "npc_02_up_1", "x": 1792, "y": 512, "w": 256, "h": 256 },

    { "name": "npc_03_down_0", "x": 0, "y": 768, "w": 256, "h": 256 },
    { "name": "npc_03_down_1", "x": 256, "y": 768, "w": 256, "h": 256 },
    { "name": "npc_03_left_0", "x": 512, "y": 768, "w": 256, "h": 256 },
    { "name": "npc_03_left_1", "x": 768, "y": 768, "w": 256, "h": 256 },
    { "name": "npc_03_right_0", "x": 1024, "y": 768, "w": 256, "h": 256 },
    { "name": "npc_03_right_1", "x": 1280, "y": 768, "w": 256, "h": 256 },
    { "name": "npc_03_up_0", "x": 1536, "y": 768, "w": 256, "h": 256 },
    { "name": "npc_03_up_1", "x": 1792, "y": 768, "w": 256, "h": 256 },

    { "name": "npc_04_down_0", "x": 0, "y": 1024, "w": 256, "h": 256 },
    { "name": "npc_04_down_1", "x": 256, "y": 1024, "w": 256, "h": 256 },
    { "name": "npc_04_left_0", "x": 512, "y": 1024, "w": 256, "h": 256 },
    { "name": "npc_04_left_1", "x": 768, "y": 1024, "w": 256, "h": 256 },
    { "name": "npc_04_right_0", "x": 1024, "y": 1024, "w": 256, "h": 256 },
    { "name": "npc_04_right_1", "x": 1280, "y": 1024, "w": 256, "h": 256 },
    { "name": "npc_04_up_0", "x": 1536, "y": 1024, "w": 256, "h": 256 },
    { "name": "npc_04_up_1", "x": 1792, "y": 1024, "w": 256, "h": 256 },

    { "name": "npc_05_down_0", "x": 0, "y": 1280, "w": 256, "h": 256 },
    { "name": "npc_05_down_1", "x": 256, "y": 1280, "w": 256, "h": 256 },
    { "name": "npc_05_left_0", "x": 512, "y": 1280, "w": 256, "h": 256 },
    { "name": "npc_05_left_1", "x": 768, "y": 1280, "w": 256, "h": 256 },
    { "name": "npc_05_right_0", "x": 1024, "y": 1280, "w": 256, "h": 256 },
    { "name": "npc_05_right_1", "x": 1280, "y": 1280, "w": 256, "h": 256 },
    { "name": "npc_05_up_0", "x": 1536, "y": 1280, "w": 256, "h": 256 },
    { "name": "npc_05_up_1", "x": 1792, "y": 1280, "w": 256, "h": 256 },

    { "name": "npc_06_down_0", "x": 0, "y": 1536, "w": 256, "h": 256 },
    { "name": "npc_06_down_1", "x": 256, "y": 1536, "w": 256, "h": 256 },
    { "name": "npc_06_left_0", "x": 512, "y": 1536, "w": 256, "h": 256 },
    { "name": "npc_06_left_1", "x": 768, "y": 1536, "w": 256, "h": 256 },
    { "name": "npc_06_right_0", "x": 1024, "y": 1536, "w": 256, "h": 256 },
    { "name": "npc_06_right_1", "x": 1280, "y": 1536, "w": 256, "h": 256 },
    { "name": "npc_06_up_0", "x": 1536, "y": 1536, "w": 256, "h": 256 },
    { "name": "npc_06_up_1", "x": 1792, "y": 1536, "w": 256, "h": 256 },

    { "name": "npc_07_down_0", "x": 0, "y": 1792, "w": 256, "h": 256 },
    { "name": "npc_07_down_1", "x": 256, "y": 1792, "w": 256, "h": 256 },
    { "name": "npc_07_left_0", "x": 512, "y": 1792, "w": 256, "h": 256 },
    { "name": "npc_07_left_1", "x": 768, "y": 1792, "w": 256, "h": 256 },
    { "name": "npc_07_right_0", "x": 1024, "y": 1792, "w": 256, "h": 256 },
    { "name": "npc_07_right_1", "x": 1280, "y": 1792, "w": 256, "h": 256 },
    { "name": "npc_07_up_0", "x": 1536, "y": 1792, "w": 256, "h": 256 },
    { "name": "npc_07_up_1", "x": 1792, "y": 1792, "w": 256, "h": 256 }
  ],
  "blankDetector": {
    "enabled": true,
    "mode": "checkerboard",
    "threshold": 0.9
  },
  "namingPrefix": "npc",
  "aliases": {
    "businesswoman_headset": "npc_00",
    "police_officer": "npc_01",
    "clipboard_man": "npc_02",
    "tech_guy": "npc_03",
    "businesswoman": "npc_04",
    "barista": "npc_05",
    "announcer": "npc_06",
    "casual_guy": "npc_07"
  }
}
